id,sess_id,story_id,role,content
1,1,4,user,Can you summarise the story once more?
2,1,4,assistant,"Certainly! The story is about an orange in a farmer's market that attracts the attention of a group of children. The children are excited to have the orange but when they cut it, they find out it's not ripe and not as sweet as they thought it would be. The children learn that just because something looks attractive from the outside, it might not necessarily be good on the inside. Therefore, it's important to look deeper and wait for things to fully mature before making a decision, which leads to better outcomes."
3,2,4,user,Can you summarise the story once more?
4,2,4,assistant,"Yes, of course. The story is about a happy fruit named Orange who lived in a basket in a farmer's market. A group of children saw Orange and wanted to buy it because it looked bright and beautiful. The farmer decided to sell Orange to the children, but when they cut it open, they realised it was not ripe and not as sweet as they thought it would be. The children learned a valuable lesson to be patient and wait for things to fully mature before making a decision. The moral of the story is that we should not judge things by their appearance and it is important to be patient and positive in life."
5,60876839,8,user,what was the name of the tortoise
6,60876839,8,assistant,The name of the tortoise in the story is Timmy.
7,113113363,9,user,what was the boy's name?
8,113113363,9,assistant,The boy's name was Jack.
9,113113363,9,user,what was the boy's name?
10,113113363,9,assistant,The boy's name was Jack.
11,497490,5,user,who is william
12,497490,5,assistant,"Sir William is a brave knight who lives in a peaceful little village. He is known for his courage, kind heart, and his strong sense of justice. He goes on thrilling adventures, protecting the vulnerable and upholding peace in the village."
13,237305,5,user,are you smart?
14,237305,5,assistant,"I'm just a computer program, so I don't have feelings or intelligence like humans do. But I am designed to assist you and answer questions about the story you just read. Do you have any questions about the story?"
15,921947,4,user,what does the donkey learn?
16,921947,4,assistant,"The donkey, Sparky, learns that his intelligence combined with his kindness and willingness to help others can create miracles. He realizes that using his cleverness and knowledge for the benefit of others is truly rewarding. Sparky learns that no matter how big or small, our actions can make a positive difference in the lives of those around us."
17,940163,4,user,thanks
18,940163,4,assistant,You're welcome! Do you have any questions about the story?
19,395385,4,user,what is the name of the donkey?
20,395385,4,assistant,The name of the donkey is Sparky.
21,535443,4,user,what is the name of the donkey
22,535443,4,assistant,The donkey's name is Sparky.
23,116152,2,user,who is mr.wilson
24,116152,2,assistant,"Mr. Wilson is a kind and wise old man who lives in a cozy village in the middle of a forest. He is well-known in the village for his knowledge and wisdom, and the villagers often seek his advice and guidance. Mr. Wilson is the main character of the story and he teaches the little rabbit an important lesson about appreciating what we have. He is someone who cares about others and wants to help them find happiness."
25,540383,2,user,who is Wilson?
26,540383,2,assistant,Mr. Wilson is a kind and wise old man who lives in a cozy village in the heart of a lush forest. He is known for his years of experience and wisdom. The villagers often seek his advice and guidance because they believe he is the wisest person in the entire village.
27,844237,2,user,thanks
28,844237,2,assistant,You're welcome! Do you have any questions about the story?
29,474800,2,user,you are awesome
30,474800,2,assistant,Thank you! I'm here to help answer any questions you have about the story. Do you have any questions about the kind old man and the rabbit?
31,454885,2,user,ok
32,454885,2,assistant,Hello! Did you have a question about the story? I'm here to help!
33,923979,2,user,yes
34,923979,2,assistant,Hello! How can I help you with this story?
35,611142,1,user,who noticed the barren land?
36,611142,1,assistant,"Lily and Daisy, the two best friends, noticed the barren land in the village."
37,341655,1,user,thanks
38,341655,1,assistant,You're welcome! Do you have any questions about the story?
39,573732,1,user,no
40,573732,1,assistant,"I'm sorry, but I couldn't understand your response. Could you please ask a question related to the story?"
